id,text,word,mean,frq,var,victor,stadio88,user,petru,sergiu,majority
5678,"Pierderea în greutate necesită ca aportul de calorii să fie mai mic decât producția de calorii, deși niciuna dintre acestea nu trebuie să fie făcută la extrem.",niciuna,0.05,4.03,0.010000000000000002,0.0,0.0,0.0,0.25,0.0,simple
5135,"După război, Hitler a rămas în armată și, după ce a primit cursuri de informații și oratorie, a devenit ofițer de informații însărcinat cu infiltrarea în partidele politice și cu raportarea către superiorii săi cu privire la activitățile acestora.",infiltrarea,0.2,0.0,0.01,0.25,0.25,0.0,0.25,0.25,simple
5141,"De asemenea, coeficientul de frecare variază foarte mult în funcție de care sunt cele două substanțe aflate în contact, precum și de temperatura și netezimea celor două substanțe.",variază,0.2,4.19,0.01,0.25,0.25,0.25,0.25,0.0,simple
5142,"De asemenea, coeficientul de frecare variază foarte mult în funcție de care sunt cele două substanțe aflate în contact, precum și de temperatura și netezimea celor două substanțe.",netezimea,0.3,0.0,0.01,0.25,0.25,0.25,0.25,0.5,simple
5155,"Un alfabet ingenios le-a permis mayașilor să înregistreze informații pe monumentele și templele lor, oferindu-le antropologilor o modalitate excelentă de a afla mai multe despre viața și cultura mayașă.",ingenios,0.2,3.46,0.01,0.25,0.25,0.0,0.25,0.25,simple
5160,"O altă carte tratează Cascading Style Sheets (CSS) care se ocupă de aspectul general și de stilizare, dar cartea de față abordează pe scurt CSS.",abordează,0.2,3.84,0.01,0.25,0.25,0.0,0.25,0.25,simple
5163,"În calitate de guvernator, a urmat o politică atât de strictă de a numi în funcții doar colegi republicani, încât a devenit părintele sistemului de favoruri din America.",favoruri,0.2,3.23,0.01,0.25,0.25,0.0,0.25,0.25,simple
5166,"Ca adjective, terminațiile lor variază în funcție de substantivele pe care le modifică.",substantivele,0.2,0.0,0.01,0.25,0.25,0.25,0.25,0.0,simple
5183,"Pe lângă lexicul nou, ar trebui să vă uitați și la modul în care se conjugă verbele în funcție de subiectul propoziției.",conjugă,0.3,0.0,0.01,0.25,0.25,0.25,0.25,0.5,simple
5189,"Oficialii britanici din domeniul comerțului au considerat că prima prioritate era popularea zonelor recent securizate din Canada și Florida (cu referire la Tratatul de la Paris), unde se putea aștepta în mod rezonabil ca coloniștii să facă comerț cu patria mamă.",securizate,0.3,3.08,0.01,0.25,0.25,0.25,0.25,0.5,simple
5215,"Fonturile decorative sunt mai potrivite pentru caractere de afișare (mai mari de 14 puncte), în timp ce caracterele mai simple sunt mai potrivite pentru text (mai puțin de 14 puncte).",Fonturile,0.3,0.0,0.01,0.25,0.25,0.25,0.25,0.5,simple
5219,"În ciuda acestui fapt, putem vedea că există încă o anumită interacțiune între Dumbledore și McGonagall, McGonagall fiind o influență moderată asupra tuturor părților, în timp ce manifestă o loialitate fermă față de Dumbledore.",loialitate,0.2,3.71,0.01,0.25,0.25,0.0,0.25,0.25,simple
5252,"El crede că ei exprimă aceleași preocupări pe care le simte și el, dar într-un mod diferit, și că este obligat moral să îi tolereze pentru că sunt mai slabi decât el.",moral,0.3,4.15,0.01,0.25,0.25,0.25,0.25,0.5,simple
5254,"A avut un dosar de serviciu exemplar și a primit prestigioasa Cruce de Fier, atât de clasa I, cât și de clasa a II-a, și a obținut, de asemenea, gradul nedistins de caporal.",prestigioasa,0.2,3.28,0.01,0.25,0.25,0.0,0.25,0.25,simple
5264,"Cu toate acestea, dacă programul este un fel de editor care rulează pe un desktop, este posibil să doriți să oferiți operatorului opțiunea de a salva informațiile introduse cu trudă în loc să iasă din program.",trudă,0.2,0.0,0.01,0.25,0.25,0.0,0.25,0.25,simple
5273,"Cu toate acestea, ploile abundente și persistente și furtunile pot provoca inundații și înnămolire a solului, precum și eroziune gravă cauzată de ploi.",persistente,0.2,3.38,0.01,0.25,0.25,0.0,0.25,0.25,simple
5277,"Cu toate acestea, în general, este necesar să se aplice aceste legi la un volum de control infinitezimal, apoi să se utilizeze ecuațiile diferențiale rezultate.",rezultate,0.2,4.89,0.01,0.25,0.25,0.0,0.25,0.25,simple
5279,"Cu toate acestea, este rareori nevoie să spunem că acest artificiu ar avea o valoare limitată dacă am ști că mitul este o minciună.",artificiu,0.3,0.0,0.01,0.25,0.25,0.25,0.25,0.5,simple
5280,"Cu toate acestea, este rareori nevoie să spunem că acest artificiu ar avea o valoare limitată dacă am ști că mitul este o minciună.",mitul,0.2,3.89,0.01,0.25,0.25,0.0,0.25,0.25,simple
5293,Vă înțeleg preocupările legate de problemele legate de copyright și de necesitatea de a menține integritatea conținutului de pe platformă.,preocupările,0.2,3.75,0.01,0.25,0.25,0.25,0.25,0.0,simple
5304,"În încercarea de a îmbunătăți acuratețea, armata a angajat un grup mare de matematicieni pentru a calcula continuu ecuațiile diferențiale necesare pentru rezolvarea tabelelor de tragere balistică.",continuu,0.3,4.46,0.01,0.25,0.25,0.25,0.25,0.5,simple
5313,"Pentru a obține acest câmp, camera trebuie să fie suficient de reverberantă, iar frecvențele trebuie să fie suficient de înalte pentru a evita efectele modurilor predominante.",predominante,0.3,3.11,0.01,0.25,0.25,0.25,0.25,0.5,simple
5321,"În exemplul de mai sus, cantitatea conservată ar fi șosetele, sistemul ar fi uscătorul, iar sistemul este închis atâta timp cât nimeni nu introduce sau scoate șosete din uscător.",introduce,0.2,4.26,0.01,0.25,0.25,0.0,0.25,0.25,simple
5377,"În cele din urmă, studiul a analizat conversia fosfolipidelor bogate în polinesaturate în triacilgliceride prin intermediul unei căi a fosfolipazei C.",analizat,0.2,3.88,0.01,0.25,0.25,0.0,0.25,0.25,simple
5390,Multe federații folosesc aceste subvenții pentru a corecta dezechilibrele dintre impozite și cheltuieli la diferite niveluri de guvernare.,subvenții,0.3,3.49,0.01,0.25,0.25,0.25,0.25,0.5,simple
5395,"Laptele este un aliment nutritiv valoros, oferind vitamine și grăsimi esențiale celor care îl pot digera în mod corespunzător.",nutritiv,0.2,0.0,0.01,0.25,0.25,0.0,0.25,0.25,simple
5397,"Laptele este un aliment nutritiv valoros, oferind vitamine și grăsimi esențiale celor care îl pot digera în mod corespunzător.",corespunzător,0.2,4.26,0.01,0.25,0.25,0.0,0.25,0.25,simple
5404,Conflictele multiple consecutive sunt observate și vor genera un mesaj ușor diferit.,Conflictele,0.2,3.89,0.01,0.25,0.25,0.25,0.25,0.0,simple
5410,"Două sau mai multe state nu vor încheia niciun tratat, confederație sau alianță între ele, fără consimțământul Statelor Unite în Congresul reunit, specificând cu exactitate scopurile pentru care se încheie și durata de valabilitate a acestuia.",alianță,0.2,4.03,0.01,0.25,0.25,0.0,0.25,0.25,simple
5411,"Două sau mai multe state nu vor încheia niciun tratat, confederație sau alianță între ele, fără consimțământul Statelor Unite în Congresul reunit, specificând cu exactitate scopurile pentru care se încheie și durata de valabilitate a acestuia.",exactitate,0.2,3.76,0.01,0.25,0.25,0.0,0.25,0.25,simple
5421,"Un lucru important de menționat este faptul că caracterele pentru numerale sunt reprezentate diferit de numărul lor corespunzător, i.e.",corespunzător,0.2,4.26,0.01,0.25,0.25,0.0,0.25,0.25,simple
5465,"Unele dintre aceste variații se referă la comisioane, protecția împotriva descoperirilor de cont, soldurile minime, legăturile permise între conturi (de exemplu, conturi curente și de economii) și regulile de deschidere a contului.",minime,0.2,3.87,0.01,0.25,0.25,0.0,0.25,0.25,simple
5473,Uneori va trebui să manipulați expresii într-o formă utilizabilă înainte de a putea efectua operații de calcul.,manipulați,0.3,0.0,0.01,0.25,0.25,0.25,0.25,0.5,simple
5476,Oțelurile sunt adesea supuse la o varietate de tratamente termice concepute pentru a produce diverse combinații de faze stabile și metastabile ale fierului.,termice,0.2,4.04,0.01,0.25,0.25,0.0,0.25,0.25,simple
5484,"Un astfel de acces ar putea fi utilizat pentru autentificarea la conectare, crearea unui nou cont de utilizator sau salvarea de informații textuale pentru a fi recuperate și studiate în viitor.",recuperate,0.2,3.64,0.01,0.25,0.25,0.0,0.25,0.25,simple
5489,"Romanii, care au folosit inițial acest stil, l-au considerat greoi și greu de manevrat pe terenul muntos și accidentat al Italiei.",manevrat,0.3,3.23,0.01,0.25,0.25,0.25,0.25,0.5,simple
5493,Clătirea cu alcool nu îndepărtează cristalul violet care maschează colorantul roșu safanin adăugat.,maschează,0.2,0.0,0.01,0.25,0.25,0.0,0.25,0.25,simple
5505,"Tabloul clasic Playfair este format din patru alfabete, de obicei în aranjament pătrat, două texte în clar și două texte cifrate.",aranjament,0.2,3.81,0.01,0.25,0.25,0.25,0.0,0.25,simple
5507,"Lucrarea combinată trebuie să conțină doar un singur exemplar al prezentei licențe, iar secțiunile invariabile multiple și identice pot fi înlocuite cu un singur exemplar.",identice,0.2,4.03,0.01,0.25,0.25,0.0,0.25,0.25,simple
5512,"Diagnosticul de schizofrenie nu ar trebui pus în prezența unor simptome depresive sau maniacale extinse, cu excepția cazului în care este clar că simptomele schizofrenice sunt anterioare tulburărilor afective.",Diagnosticul,0.2,3.87,0.01,0.25,0.25,0.0,0.25,0.25,simple
5513,"Diagnosticul de schizofrenie nu ar trebui pus în prezența unor simptome depresive sau maniacale extinse, cu excepția cazului în care este clar că simptomele schizofrenice sunt anterioare tulburărilor afective.",depresive,0.3,3.22,0.01,0.25,0.25,0.25,0.25,0.5,simple
5514,"Diagnosticul de schizofrenie nu ar trebui pus în prezența unor simptome depresive sau maniacale extinse, cu excepția cazului în care este clar că simptomele schizofrenice sunt anterioare tulburărilor afective.",anterioare,0.2,4.55,0.01,0.25,0.25,0.0,0.25,0.25,simple
5518,"Vacuola alimentară formată, apoi fuzionează cu un lizozom și digeră alimentele.",formată,0.2,4.57,0.01,0.25,0.25,0.0,0.25,0.25,simple
5522,"Formarea acestui intermediar și reacția ulterioară au, în general, o barieră de energie de activare mult mai mică decât cea necesară pentru reacția directă de transformare a reactanților în produși.",ulterioară,0.2,4.08,0.01,0.25,0.25,0.25,0.25,0.0,simple
5524,"Obiectivele acestei proceduri vor fi distribuirea de informații exacte, cu aprobările corecte, folosind tehnologii și strategii suficiente.",distribuirea,0.2,3.84,0.01,0.25,0.25,0.0,0.25,0.25,simple
5529,Chitara este un instrument de transpoziție și este notată cu o octavă mai sus decât înălțimea sa reală pentru a evita utilizarea clapei de bas în notația standard.,notația,0.3,0.0,0.01,0.25,0.25,0.25,0.25,0.5,simple
5530,Senzorul Hall și inductorul utilizează o proprietate a câmpului magnetic pentru a detecta curentul printr-un conductor din apropiere.,Senzorul,0.2,3.22,0.01,0.25,0.25,0.25,0.25,0.0,simple
5541,Principalul motiv pentru care nu se permit mai multe ieșiri cu aceeași intrare este acela că ne permite să aplicăm aceeași funcție la diferite forme ale aceluiași lucru fără a schimba echivalența acestora.,echivalența,0.3,0.0,0.01,0.25,0.25,0.25,0.25,0.5,simple
5555,"Motivul pentru care leziunile hipotalamice afectează grăsimea corporală și comportamentul alimentar are, de fapt, mult de-a face cu semnalizarea leptinei.",afectează,0.2,4.23,0.01,0.25,0.25,0.0,0.25,0.25,simple
5570,"Există, de asemenea, diferite stiluri de editare în sensul cât de îndrăzneți sunt dispuși să fie oamenii.",editare,0.2,3.86,0.01,0.25,0.25,0.0,0.25,0.25,simple
5572,"Este clar că este nevoie de o structură diferită a cărților, deoarece acestea sunt destinate să fie (cel puțin în cele din urmă) tipărite și, prin urmare, ar trebui să aibă un stil liniar.",destinate,0.2,4.39,0.01,0.25,0.25,0.0,0.25,0.25,simple
5580,"De asemenea, este posibil să existe taxe de licență separate pentru distribuția de formate de date multimedia brevetate, cum ar fi imaginile GIF, care, dacă nu în fapt, cel puțin din punct de vedere filozofic, încalcă principiile GFDL, împiedicându-vă să utilizați liber imaginea sau fotografia.",filozofic,0.3,3.2,0.01,0.25,0.25,0.25,0.25,0.5,simple
5599,"Acestea transformă energia solară în energie chimică prin absorbția luminii și utilizarea acesteia pentru a stimula sinteza compușilor organici, cum ar fi zahărul, din dioxid de carbon și apă.",absorbția,0.2,3.66,0.01,0.25,0.25,0.0,0.25,0.25,simple
5605,Ei au lăsat în urmă o profeție conform căreia lumea se va sfârși la 21 decembrie 2012 și va avea loc cel de-al cincilea ciclu al lumii.,profeție,0.2,3.34,0.01,0.25,0.25,0.0,0.25,0.25,simple
5609,"Au produs peste 90% din filmele de ficțiune din America și și-au distribuit filmele atât la nivel național, cât și internațional.",distribuit,0.2,4.02,0.01,0.25,0.25,0.0,0.25,0.25,simple
5637,Aceasta a fost o lovitură devastatoare pentru japonezi și este considerată punctul de cotitură al Războiului din Pacific.,cotitură,0.3,3.52,0.01,0.25,0.25,0.25,0.25,0.5,simple
5650,"Cu excepția cazului în care există probleme evidente care nu vor putea fi remediate, timpul dumneavoastră ar fi mai bine petrecut pentru a îndruma noii contribuitori și pentru a încerca să ajutați la curățarea noilor lucrări, chiar dacă lucrarea reprezintă în prezent o încălcare flagrantă a procedurilor actuale.",remediate,0.3,0.0,0.01,0.25,0.25,0.25,0.25,0.5,simple
5660,"Stăpânii războiului din numeroasele provincii ale Chinei se dușmăneau în mod constant, iar guvernul central era slab și descentralizat, neputând face nimic pentru a opri conflictul.",central,0.2,4.85,0.01,0.25,0.25,0.25,0.0,0.25,simple
5684,"Atunci când un text nu susține această regulă, chiar și un elev sârguincios este nevoit să repete inutil materialul.",sârguincios,0.2,0.0,0.01,0.25,0.25,0.0,0.25,0.25,simple
5685,"Atunci când un text nu susține această regulă, chiar și un elev sârguincios este nevoit să repete inutil materialul.",inutil,0.2,4.1,0.01,0.25,0.25,0.0,0.25,0.25,simple
5696,"Acordurile dvs. juridice ar trebui să treacă prin mai multe iterații în procesul de redactare, fiecare iterație simplificând termenii și îmbunătățind lizibilitatea și utilizabilitatea acestora.",redactare,0.3,3.33,0.01,0.25,0.25,0.25,0.25,0.5,simple
5698,pentru că conjugarea specifică a unui verb indică de obicei care este persoana subiectului.,conjugarea,0.3,0.0,0.01,0.25,0.25,0.25,0.25,0.5,simple
5380,"Structurile cu puncte Lewis sunt utile pentru a introduce ideea de covalență și de legătură în moleculele mici, dar alte tipuri de modele au o capacitate mult mai mare de a comunica concepte chimice.",covalență,0.8,0.0,0.009999999999999998,0.75,0.75,0.75,1.0,0.75,complex
5393,"Multe protiste de apă dulce au vacuole contractile care pompează excesul de apă din celulă, menținând astfel o concentrație adecvată de ioni și molecule în interiorul celulei.",vacuole,0.8,0.0,0.009999999999999998,0.75,0.75,0.75,0.75,1.0,complex
5563,Mărimea razei de aggro variază uneori în funcție de facțiune și de con și poate fi sferică în anumite medii.,aggro,0.95,0.0,0.009999999999999998,1.0,1.0,0.75,1.0,1.0,complex
5150,"Deși evreii au fost țintele principale și sunt victimele despre care auzim cel mai des atunci când vorbim despre Holocaust, ei nu au fost singurele victime.",auzim,0.0,4.04,0.0,0.0,0.0,0.0,0.0,0.0,simple
5151,"Deși evreii au fost țintele principale și sunt victimele despre care auzim cel mai des atunci când vorbim despre Holocaust, ei nu au fost singurele victime.",vorbim,0.0,4.95,0.0,0.0,0.0,0.0,0.0,0.0,simple
5152,"Printre aceste tehnologii se număra fisiunea nucleară, care constă în divizarea unui atom foarte electronegativ în atomi mai mici și care produce o energie de zece ori mai mare.",tehnologii,0.25,4.28,0.0,0.25,0.25,0.25,0.25,0.25,simple
5165,"Ca adjective, terminațiile lor variază în funcție de substantivele pe care le modifică.",funcție,0.25,5.32,0.0,0.25,0.25,0.25,0.25,0.25,simple
5170,"Pe lângă faptul că a fost regină a Regatului Unit al Marii Britanii și Irlandei, a fost și primul monarh care a folosit titlul de Împărăteasă a Indiei.",regină,0.0,4.36,0.0,0.0,0.0,0.0,0.0,0.0,simple
5188,"Oficialii britanici din domeniul comerțului au considerat că prima prioritate era popularea zonelor recent securizate din Canada și Florida (cu referire la Tratatul de la Paris), unde se putea aștepta în mod rezonabil ca coloniștii să facă comerț cu patria mamă.",popularea,0.25,0.0,0.0,0.25,0.25,0.25,0.25,0.25,simple
5190,"Oficialii britanici din domeniul comerțului au considerat că prima prioritate era popularea zonelor recent securizate din Canada și Florida (cu referire la Tratatul de la Paris), unde se putea aștepta în mod rezonabil ca coloniștii să facă comerț cu patria mamă.",coloniștii,0.25,3.19,0.0,0.25,0.25,0.25,0.25,0.25,simple
5204,"Încurajat de susținătorii din sud (mulți dintre ei i-au trimis lui Brooks bastoane noi, în semn de aprobare a acțiunilor sale), s-a întors după o realegere răsunătoare.",dintre,0.0,6.11,0.0,0.0,0.0,0.0,0.0,0.0,simple
5212,"În prezent, un loc este egal cu aproximativ 600 000 de alegători.",egal,0.0,4.44,0.0,0.0,0.0,0.0,0.0,0.0,simple
5221,"Au fost produse drame, comedii și toate celelalte forme de divertisment, precum și emisiuni de știri și muzică.",comedii,0.0,3.43,0.0,0.0,0.0,0.0,0.0,0.0,simple
5230,"În fiecare an, numărul de membri ai acestui club crește, iar nevoia de lideri de grupuri mici, cunoscuți și sub numele de Facilitatori de nucleu, în cămine crește și ea.",numărul,0.0,5.44,0.0,0.0,0.0,0.0,0.0,0.0,simple
5239,"Patriot ca întotdeauna, Laurens a continuat să își servească națiunea ca unul dintre cei trei reprezentanți selectați pentru a negocia condițiile la Conferința de pace de la Paris din 1782.",continuat,0.0,4.75,0.0,0.0,0.0,0.0,0.0,0.0,simple
5251,"El crede că ei exprimă aceleași preocupări pe care le simte și el, dar într-un mod diferit, și că este obligat moral să îi tolereze pentru că sunt mai slabi decât el.",crede,0.0,4.97,0.0,0.0,0.0,0.0,0.0,0.0,simple
5278,"Cu toate acestea, este rareori nevoie să spunem că acest artificiu ar avea o valoare limitată dacă am ști că mitul este o minciună.",rareori,0.0,4.02,0.0,0.0,0.0,0.0,0.0,0.0,simple
5291,Apreciez cu adevărat spiritul de colaborare al acestei platforme și mă angajez să fiu mai vigilent în ceea ce privește problemele legate de drepturile de autor în viitor.,platforme,0.25,3.97,0.0,0.25,0.25,0.25,0.25,0.25,simple
5303,"În încercarea de a îmbunătăți acuratețea, armata a angajat un grup mare de matematicieni pentru a calcula continuu ecuațiile diferențiale necesare pentru rezolvarea tabelelor de tragere balistică.",calcula,0.0,3.67,0.0,0.0,0.0,0.0,0.0,0.0,simple
5307,"La multe specii anuale în condiții nefavorabile de uscăciune sau de frig, există doar sămânța.",există,0.0,5.67,0.0,0.0,0.0,0.0,0.0,0.0,simple
5308,"În nordul Europei (nordul Germaniei, Țările de Jos și Franța), clasa de mijloc avea tendința de a fi protestantă, ceea ce corespundea cu etica și filozofia muncii.",nordul,0.0,4.49,0.0,0.0,0.0,0.0,0.0,0.0,simple
5309,"În nordul Europei (nordul Germaniei, Țările de Jos și Franța), clasa de mijloc avea tendința de a fi protestantă, ceea ce corespundea cu etica și filozofia muncii.",tendința,0.25,4.26,0.0,0.25,0.25,0.25,0.25,0.25,simple
5310,"În nordul Europei (nordul Germaniei, Țările de Jos și Franța), clasa de mijloc avea tendința de a fi protestantă, ceea ce corespundea cu etica și filozofia muncii.",corespundea,0.25,0.0,0.0,0.25,0.25,0.25,0.25,0.25,simple
5322,"În exemplul de mai sus, cantitatea conservată ar fi șosetele, sistemul ar fi uscătorul, iar sistemul este închis atâta timp cât nimeni nu introduce sau scoate șosete din uscător.",șosete,0.0,3.66,0.0,0.0,0.0,0.0,0.0,0.0,simple
5330,"În acest sistem, compușii sunt denumiți prin analogie cu gliceraldehida, ceea ce produce în general denumiri neambigue, dar este cel mai ușor de observat în cazul micilor biomolecule similare gliceraldehidei.",ușor,0.0,5.42,0.0,0.0,0.0,0.0,0.0,0.0,simple
5334,În cadrul conferinței au fost prezentate datele inițiale ale analizei medicamentului pentru boli cardiovasculare simvastatin.,simvastatin,1.0,0.0,0.0,1.0,1.0,1.0,1.0,1.0,complex
5336,"În schimb, trece imediat la biții de oprire, ceea ce reprezintă o recunoaștere a faptului că verificarea parității la acest nivel este cu adevărat inutilă.",imediat,0.0,5.22,0.0,0.0,0.0,0.0,0.0,0.0,simple
5345,"Oasele neregulate au forme deosebite, nu pot fi grupate sub capetele precedente și sunt folosite pentru atașarea mușchilor și pentru articulații.",precedente,0.25,3.97,0.0,0.25,0.25,0.25,0.25,0.25,simple
5347,"Adaugă un buton la bara de instrumente de editare din editorul de surse, astfel încât este cel mai convenabil pentru paginile de discuții ale utilizatorilor cu legături roșii, dar poate economisi un clic sau două și în alte cazuri, chiar dacă nu este la fel de rapid ca Twinkle.",buton,0.0,4.08,0.0,0.0,0.0,0.0,0.0,0.0,simple
5352,"S-a spus că a trebuit să își croiască drum prin păduri fără urme, ceea ce, fără îndoială, a fost cazul cel puțin în acest oraș.",oraș,0.0,5.35,0.0,0.0,0.0,0.0,0.0,0.0,simple
5359,"Este utilizat de sistemul imunitar, pentru sinteza ADN-ului, pentru vindecarea rănilor și pentru creșterea și dezvoltarea normală în perioadele cu activitate hormonală.",imunitar,0.25,3.63,0.0,0.25,0.25,0.25,0.25,0.25,simple
5360,"Este utilizat de sistemul imunitar, pentru sinteza ADN-ului, pentru vindecarea rănilor și pentru creșterea și dezvoltarea normală în perioadele cu activitate hormonală.",vindecarea,0.0,3.68,0.0,0.0,0.0,0.0,0.0,0.0,simple
5364,"Acesta prezintă în mod repetat ilustrații ale cercetașilor în scene însorite de munte, fără niciun fel de pălării.",niciun,0.0,5.12,0.0,0.0,0.0,0.0,0.0,0.0,simple
5378,"În cele din urmă, studiul a analizat conversia fosfolipidelor bogate în polinesaturate în triacilgliceride prin intermediul unei căi a fosfolipazei C.",bogate,0.0,4.32,0.0,0.0,0.0,0.0,0.0,0.0,simple
5386,"Poșta este generată intern de către sistemul Postfix însuși, pentru a notifica poștașul despre o problemă (această cale este, de asemenea, indicată cu săgeata fără etichetă).",generată,0.25,3.77,0.0,0.25,0.25,0.25,0.25,0.25,simple
5389,Multe federații folosesc aceste subvenții pentru a corecta dezechilibrele dintre impozite și cheltuieli la diferite niveluri de guvernare.,federații,0.25,3.22,0.0,0.25,0.25,0.25,0.25,0.25,simple
5409,"Aproape de sfârșitul războiului, Germania încearcă să lupte pentru o ultimă luptă cu Aliații.",luptă,0.0,5.16,0.0,0.0,0.0,0.0,0.0,0.0,simple
5418,"Pe partea germană, însă, s-a format un decalaj între cele mai vestice corpuri de armată, iar înaintarea rapidă a epuizat trupele.",rapidă,0.0,4.56,0.0,0.0,0.0,0.0,0.0,0.0,simple
5426,"Doar Piatra Învierii i se pare dubioasă pentru Hermione, deși Harry speră că aceasta i-ar putea învia părinții morți.",speră,0.0,3.8,0.0,0.0,0.0,0.0,0.0,0.0,simple
5440,"Cu dimensiuni variate, de la lacuri de mari dimensiuni și văi închise la iazuri în miniatură, aceste depresiuni au fost lăsate de gheața îngropată care s-a topit în cele din urmă.",lacuri,0.0,3.91,0.0,0.0,0.0,0.0,0.0,0.0,simple
5448,Respirația de salvare este utilizată dacă victima nu începe să respire atunci când se deschid căile respiratorii.,începe,0.0,5.3,0.0,0.0,0.0,0.0,0.0,0.0,simple
5449,"Tampoanele sensibile ale degetelor noastre, folosite ca antene tactile, detectează cea mai mică tresărire, încordare sau ezitare de răspuns.",degetelor,0.0,3.65,0.0,0.0,0.0,0.0,0.0,0.0,simple
5458,"Deoarece majoritatea manualelor sunt elaborate de către sau pe baza contribuțiilor experților în domeniu, această cerință este, de obicei, bine respectată.",manualelor,0.0,0.0,0.0,0.0,0.0,0.0,0.0,0.0,simple
5467,"Este posibil ca unele părți să nu fie consumate niciodată, iar altele nu sunt procesate în mod normal ca și carne cușer în Statele Unite, din cauza muncii suplimentare pe care o implică.",normal,0.0,5.04,0.0,0.0,0.0,0.0,0.0,0.0,simple
5468,"Este posibil ca unele părți să nu fie consumate niciodată, iar altele nu sunt procesate în mod normal ca și carne cușer în Statele Unite, din cauza muncii suplimentare pe care o implică.",carne,0.0,4.77,0.0,0.0,0.0,0.0,0.0,0.0,simple
5485,"Suzuki Pureharp este unul dintre micile modele de producție care sunt acoperite în lemn, ceea ce produce un sunet moale și plăcut.",micile,0.0,3.86,0.0,0.0,0.0,0.0,0.0,0.0,simple
5487,"Suzuki Pureharp este unul dintre micile modele de producție care sunt acoperite în lemn, ceea ce produce un sunet moale și plăcut.",plăcut,0.0,4.96,0.0,0.0,0.0,0.0,0.0,0.0,simple
5490,"Romanii, care au folosit inițial acest stil, l-au considerat greoi și greu de manevrat pe terenul muntos și accidentat al Italiei.",muntos,0.0,3.29,0.0,0.0,0.0,0.0,0.0,0.0,simple
5501,Elementul central al mănăstirii renovate a fost un altar dedicat lui Edward.,mănăstirii,0.0,4.41,0.0,0.0,0.0,0.0,0.0,0.0,simple
5515,"Întreaga aplicație asamblată este platforma lor, iar birourile personalului afectat reprezintă domeniul țintă pentru munca lor.",personalului,0.25,4.13,0.0,0.25,0.25,0.25,0.25,0.25,simple
5534,"Eroul a fost apoi chemat să participe la cel de-al doilea rit cel al cuceririi, învingând pe generalul mercenar Claudius.",învingând,0.0,3.24,0.0,0.0,0.0,0.0,0.0,0.0,simple
