id,text,word,mean,frq,var,victor,stadio88,user,petru,sergiu,majority
5281,"Cu toate acestea, ar trebui să fie clar că diferite lungimi de undă vor suferi interferențe constructive pentru diferite unghiuri de incidență a luminii primite.",suferi,0.1,4.27,0.015000000000000003,0.25,0.0,0.0,0.0,0.25,simple
5283,"Cu toate acestea, ar trebui să fie clar că diferite lungimi de undă vor suferi interferențe constructive pentru diferite unghiuri de incidență a luminii primite.",unghiuri,0.15,3.69,0.015000000000000003,0.25,0.0,0.25,0.25,0.0,simple
5286,"Cu toate acestea, atenuarea nu poate merge decât până la nivelul plasticii sinaptice și corticale a creierului, deoarece gravitatea ADHD depinde în principal de aspectele neurobiologice.",principal,0.15,5.11,0.015000000000000003,0.25,0.25,0.25,0.0,0.0,simple
5289,"Peroxidul de hidrogen se va degrada spontan în apă și oxigen molecular, însă prezența unui catalizator accelerează această reacție până la punctul în care a fost folosit ca sursă de combustibil pentru torpile și chiar pentru nave spațiale.",accelerează,0.15,3.63,0.015000000000000003,0.25,0.25,0.0,0.25,0.0,simple
5290,Apreciez cu adevărat spiritul de colaborare al acestei platforme și mă angajez să fiu mai vigilent în ceea ce privește problemele legate de drepturile de autor în viitor.,colaborare,0.1,4.89,0.015000000000000003,0.25,0.0,0.0,0.25,0.0,simple
5292,Apreciez cu adevărat spiritul de colaborare al acestei platforme și mă angajez să fiu mai vigilent în ceea ce privește problemele legate de drepturile de autor în viitor.,angajez,0.15,3.22,0.015000000000000003,0.25,0.25,0.0,0.0,0.25,simple
5295,Vă înțeleg preocupările legate de problemele legate de copyright și de necesitatea de a menține integritatea conținutului de pe platformă.,menține,0.15,4.38,0.015000000000000003,0.25,0.25,0.0,0.25,0.0,simple
5296,"Dacă nu, masați ușor mușchiul cu crampe, puteți încerca, de asemenea, să aplicați gheață.",masați,0.1,0.0,0.015000000000000003,0.25,0.25,0.0,0.0,0.0,simple
5298,"Dacă nu, masați ușor mușchiul cu crampe, puteți încerca, de asemenea, să aplicați gheață.",aplicați,0.1,0.0,0.015000000000000003,0.25,0.25,0.0,0.0,0.0,simple
5299,"Dacă este posibil, găsiți un apicultor din zona dumneavoastră care ar putea fi dispus să vă ghideze sau chiar să vă îndrume în timpul noului dumneavoastră interes.",dispus,0.1,4.5,0.015000000000000003,0.25,0.0,0.0,0.25,0.0,simple
5300,"Dacă este posibil, găsiți un apicultor din zona dumneavoastră care ar putea fi dispus să vă ghideze sau chiar să vă îndrume în timpul noului dumneavoastră interes.",îndrume,0.1,3.02,0.015000000000000003,0.25,0.0,0.0,0.25,0.0,simple
5302,"În încercarea de a îmbunătăți acuratețea, armata a angajat un grup mare de matematicieni pentru a calcula continuu ecuațiile diferențiale necesare pentru rezolvarea tabelelor de tragere balistică.",matematicieni,0.1,3.05,0.015000000000000003,0.0,0.25,0.0,0.0,0.25,simple
5305,"La multe specii anuale în condiții nefavorabile de uscăciune sau de frig, există doar sămânța.",anuale,0.1,4.26,0.015000000000000003,0.0,0.25,0.0,0.25,0.0,simple
5314,"În chimia organică, carbonul este utilizat foarte frecvent, astfel încât chimiștii știu că există un atom de carbon la capetele fiecărei linii care nu este etichetată în mod explicit.",frecvent,0.15,4.55,0.015000000000000003,0.25,0.25,0.0,0.25,0.0,simple
5315,"În chimia organică, carbonul este utilizat foarte frecvent, astfel încât chimiștii știu că există un atom de carbon la capetele fiecărei linii care nu este etichetată în mod explicit.",chimiștii,0.15,0.0,0.015000000000000003,0.0,0.25,0.25,0.25,0.0,simple
5317,"În contextul limbajelor de programare, în cazul limbajelor declarative, se furnizează date și reguli computerului, care pot fi apoi interogate pentru a oferi date înapoi.",programare,0.15,4.23,0.015000000000000003,0.25,0.25,0.0,0.25,0.0,simple
5332,În cadrul conferinței au fost prezentate datele inițiale ale analizei medicamentului pentru boli cardiovasculare simvastatin.,prezentate,0.1,4.53,0.015000000000000003,0.25,0.0,0.0,0.25,0.0,simple
5337,"În schimb, trece imediat la biții de oprire, ceea ce reprezintă o recunoaștere a faptului că verificarea parității la acest nivel este cu adevărat inutilă.",recunoaștere,0.15,4.27,0.015000000000000003,0.25,0.0,0.0,0.25,0.25,simple
5338,"În loc să vă bazați pe faptul că aceștia au shell potrivit, puteți specifica pur și simplu ce shell ar trebui să folosească.",bazați,0.1,3.01,0.015000000000000003,0.25,0.0,0.0,0.25,0.0,simple
5351,"S-a spus că a trebuit să își croiască drum prin păduri fără urme, ceea ce, fără îndoială, a fost cazul cel puțin în acest oraș.",îndoială,0.1,4.54,0.015000000000000003,0.25,0.0,0.0,0.25,0.0,simple
5357,"Este important ca atunci când planificați o lecție de învățare mixtă în clasele primare să vă concentrați pe o unitate de studiu, apoi să o împletiți cu tehnologia.",clasele,0.1,4.3,0.015000000000000003,0.25,0.0,0.0,0.25,0.0,simple
5363,"Acesta prezintă în mod repetat ilustrații ale cercetașilor în scene însorite de munte, fără niciun fel de pălării.",ilustrații,0.15,3.63,0.015000000000000003,0.25,0.25,0.0,0.0,0.25,simple
5365,"A fost descoperită de tonți și de alți vorbitori de engleză și, pentru o vreme, postarea între cele două limbi a înflorit.",descoperită,0.15,4.08,0.015000000000000003,0.25,0.25,0.0,0.0,0.25,simple
5368,"Vă va duce la pagina care corespunde cererii dumneavoastră, altfel va afișa rezultatele căutării.",corespunde,0.15,4.26,0.015000000000000003,0.25,0.0,0.0,0.25,0.25,simple
5382,"Structurile cu puncte Lewis sunt utile pentru a introduce ideea de covalență și de legătură în moleculele mici, dar alte tipuri de modele au o capacitate mult mai mare de a comunica concepte chimice.",comunica,0.15,3.92,0.015000000000000003,0.0,0.25,0.25,0.25,0.0,simple
5387,"Poșta este generată intern de către sistemul Postfix însuși, pentru a notifica poștașul despre o problemă (această cale este, de asemenea, indicată cu săgeata fără etichetă).",notifica,0.15,0.0,0.015000000000000003,0.25,0.25,0.0,0.25,0.0,simple
5391,Multe federații folosesc aceste subvenții pentru a corecta dezechilibrele dintre impozite și cheltuieli la diferite niveluri de guvernare.,cheltuieli,0.15,3.88,0.015000000000000003,0.25,0.0,0.0,0.25,0.25,simple
5396,"Laptele este un aliment nutritiv valoros, oferind vitamine și grăsimi esențiale celor care îl pot digera în mod corespunzător.",grăsimi,0.1,3.61,0.015000000000000003,0.0,0.0,0.25,0.25,0.0,simple
5398,"Utilizarea modernă a emoticoanelor în discuțiile electronice se datorează, în general, unei propuneri din 1982.>>",emoticoanelor,0.15,0.0,0.015000000000000003,0.25,0.0,0.0,0.25,0.25,simple
5399,"Utilizarea modernă a emoticoanelor în discuțiile electronice se datorează, în general, unei propuneri din 1982.>>",electronice,0.15,4.46,0.015000000000000003,0.25,0.25,0.0,0.25,0.0,simple
5400,"Utilizarea modernă a emoticoanelor în discuțiile electronice se datorează, în general, unei propuneri din 1982.>>",datorează,0.1,4.43,0.015000000000000003,0.0,0.25,0.0,0.25,0.0,simple
5401,"Cele mai multe interogări DNS (cum ar fi cererile de rezolvare a numelui) utilizează conexiuni UDP, deoarece cantitatea de date transferate este mică, iar stabilirea sesiunii ar introduce un trafic și o sarcină inutile asupra serverelor de nume.",introduce,0.1,4.26,0.015000000000000003,0.25,0.0,0.0,0.25,0.0,simple
5403,"Cele mai multe interogări DNS (cum ar fi cererile de rezolvare a numelui) utilizează conexiuni UDP, deoarece cantitatea de date transferate este mică, iar stabilirea sesiunii ar introduce un trafic și o sarcină inutile asupra serverelor de nume.",inutile,0.1,3.87,0.015000000000000003,0.25,0.0,0.0,0.25,0.0,simple
5405,Conflictele multiple consecutive sunt observate și vor genera un mesaj ușor diferit.,consecutive,0.15,4.0,0.015000000000000003,0.25,0.0,0.0,0.25,0.25,simple
5412,"Două sau mai multe state nu vor încheia niciun tratat, confederație sau alianță între ele, fără consimțământul Statelor Unite în Congresul reunit, specificând cu exactitate scopurile pentru care se încheie și durata de valabilitate a acestuia.",scopurile,0.1,3.74,0.015000000000000003,0.25,0.0,0.0,0.25,0.0,simple
5414,"Adesea, paginile de discuții ale subiectelor controversate pot fi foarte intens utilizate.",subiectelor,0.15,3.29,0.015000000000000003,0.25,0.0,0.0,0.25,0.25,simple
5415,"Adesea, paginile de discuții ale subiectelor controversate pot fi foarte intens utilizate.",intens,0.15,4.31,0.015000000000000003,0.25,0.0,0.0,0.25,0.25,simple
5416,"Pe partea germană, însă, s-a format un decalaj între cele mai vestice corpuri de armată, iar înaintarea rapidă a epuizat trupele.",vestice,0.1,3.65,0.015000000000000003,0.25,0.0,0.0,0.25,0.0,simple
5422,"La o săptămână de la ultimul comentariu, dacă participanții au ajuns în mare parte la un consens cu privire la ceea ce trebuie făcut, un administrator va lua măsuri.",participanții,0.15,4.05,0.015000000000000003,0.25,0.0,0.0,0.25,0.25,simple
5427,"Doar Piatra Învierii i se pare dubioasă pentru Hermione, deși Harry speră că aceasta i-ar putea învia părinții morți.",învia,0.1,3.25,0.015000000000000003,0.0,0.0,0.0,0.25,0.25,simple
5428,"Chimia organică se concentrează asupra carbonului și urmărește mișcarea electronilor în lanțurile și inelele de carbon, precum și modul în care electronii sunt împărțiți cu alți atomi de carbon și heteroatomi.",concentrează,0.1,4.21,0.015000000000000003,0.0,0.0,0.0,0.25,0.25,simple
5429,"Chimia organică se concentrează asupra carbonului și urmărește mișcarea electronilor în lanțurile și inelele de carbon, precum și modul în care electronii sunt împărțiți cu alți atomi de carbon și heteroatomi.",împărțiți,0.1,3.66,0.015000000000000003,0.25,0.0,0.0,0.25,0.0,simple
5434,Imaginați-vă că deschideți capota unei mașini și găsiți o mașină de spălat în locul motorului.,capota,0.1,3.34,0.015000000000000003,0.0,0.25,0.0,0.0,0.25,simple
5439,"Proiectele de lege private afectează o anumită companie, persoană sau altă entitate (de exemplu, autorizarea unor construcții majore pe anumite terenuri publice).",anumite,0.1,5.01,0.015000000000000003,0.25,0.0,0.0,0.25,0.0,simple
5452,"Ea aranjează împrumutul unui reparator de la un concurent, dar între timp organizează un număr mare de oameni cu lanterne într-un sistem manual de semnalizare.",aranjează,0.15,3.36,0.015000000000000003,0.25,0.0,0.0,0.25,0.25,simple
5453,"Ea aranjează împrumutul unui reparator de la un concurent, dar între timp organizează un număr mare de oameni cu lanterne într-un sistem manual de semnalizare.",organizează,0.15,4.41,0.015000000000000003,0.25,0.0,0.0,0.25,0.25,simple
5455,"Fusese surprinsă de faptul că Taggart trecuse într-o zi, din senin, prin camera ei de mahala.",surprinsă,0.1,3.91,0.015000000000000003,0.25,0.0,0.0,0.25,0.0,simple
5475,Uneori va trebui să manipulați expresii într-o formă utilizabilă înainte de a putea efectua operații de calcul.,efectua,0.1,4.12,0.015000000000000003,0.0,0.0,0.0,0.25,0.25,simple
5480,O astfel de cavitate poate oferi numeroase avantaje funcționale.,numeroase,0.1,4.96,0.015000000000000003,0.0,0.0,0.0,0.25,0.25,simple
5482,"Un astfel de acces ar putea fi utilizat pentru autentificarea la conectare, crearea unui nou cont de utilizator sau salvarea de informații textuale pentru a fi recuperate și studiate în viitor.",conectare,0.15,3.38,0.015000000000000003,0.25,0.25,0.0,0.25,0.0,simple
5491,Clătirea cu alcool nu îndepărtează cristalul violet care maschează colorantul roșu safanin adăugat.,Clătirea,0.1,0.0,0.015000000000000003,0.0,0.25,0.0,0.25,0.0,simple
5492,Clătirea cu alcool nu îndepărtează cristalul violet care maschează colorantul roșu safanin adăugat.,alcool,0.1,4.37,0.015000000000000003,0.0,0.0,0.25,0.25,0.0,simple
5494,Linia mare și curbată din stânga este îndreptată în mod elaborat spre mine (mi).,curbată,0.1,3.13,0.015000000000000003,0.0,0.0,0.0,0.25,0.25,simple
5502,Elementul central al mănăstirii renovate a fost un altar dedicat lui Edward.,renovate,0.1,3.21,0.015000000000000003,0.25,0.0,0.0,0.25,0.0,simple
5506,"Lucrarea combinată trebuie să conțină doar un singur exemplar al prezentei licențe, iar secțiunile invariabile multiple și identice pot fi înlocuite cu un singur exemplar.",combinată,0.1,3.75,0.015000000000000003,0.0,0.0,0.0,0.25,0.25,simple
5516,"Întreaga aplicație asamblată este platforma lor, iar birourile personalului afectat reprezintă domeniul țintă pentru munca lor.",afectat,0.1,4.34,0.015000000000000003,0.25,0.0,0.0,0.25,0.0,simple
5525,"Obiectivele acestei proceduri vor fi distribuirea de informații exacte, cu aprobările corecte, folosind tehnologii și strategii suficiente.",aprobările,0.1,0.0,0.015000000000000003,0.25,0.0,0.0,0.25,0.0,simple
5532,Senzorul Hall și inductorul utilizează o proprietate a câmpului magnetic pentru a detecta curentul printr-un conductor din apropiere.,magnetic,0.15,3.78,0.015000000000000003,0.0,0.25,0.0,0.25,0.25,simple
5542,"Majoritatea algelor marine, cum ar fi kelps (alge brune foarte mari din ordinul Laminariales), în ciuda unei astfel de aparențe superficiale, nu au tulpini adevărate, frunze, rădăcini și nici un fel de sistem vascular, așa cum se găsește la plantele superioare.",brune,0.15,3.01,0.015000000000000003,0.0,0.25,0.0,0.25,0.25,simple
5545,"A doua zi, în timpul Fajr Salaah, l-a înjunghiat pe Sayyiduna Umar (radi Allahu anhu) de 6 ori în spate, rănind grav pe calif.",înjunghiat,0.1,3.74,0.015000000000000003,0.25,0.0,0.0,0.25,0.0,simple
5559,Descrierea configurației relative este încă utilizată în principal în glicochimie.,principal,0.1,5.11,0.015000000000000003,0.25,0.0,0.0,0.25,0.0,simple
5567,"Teatrul a contribuit cu strigăte dramatice, inclusiv cele ale lui Mary Otis Warren.",contribuit,0.1,4.45,0.015000000000000003,0.25,0.0,0.0,0.25,0.0,simple
5568,"Teatrul a contribuit cu strigăte dramatice, inclusiv cele ale lui Mary Otis Warren.",dramatice,0.15,3.96,0.015000000000000003,0.25,0.0,0.0,0.25,0.25,simple
5569,"Există, de asemenea, diferite stiluri de editare în sensul cât de îndrăzneți sunt dispuși să fie oamenii.",stiluri,0.1,4.0,0.015000000000000003,0.25,0.0,0.0,0.25,0.0,simple
5576,Există o ușoară tendință de atac din partea opusă a halogenului.,tendință,0.15,3.99,0.015000000000000003,0.25,0.25,0.25,0.0,0.0,simple
5578,"De asemenea, este posibil să existe taxe de licență separate pentru distribuția de formate de date multimedia brevetate, cum ar fi imaginile GIF, care, dacă nu în fapt, cel puțin din punct de vedere filozofic, încalcă principiile GFDL, împiedicându-vă să utilizați liber imaginea sau fotografia.",taxe,0.1,4.14,0.015000000000000003,0.0,0.0,0.0,0.25,0.25,simple
5581,"Prin urmare, indiferent cât de mult argou folosiți în limba dvs. maternă, limitarea utilizării argoului în limba franceză (proporțional cu nivelul dvs. de fluență) va limita, de asemenea, cât de mult sunteți tratat cu condescendență și amuzament de către ascultătorii nativi.",limitarea,0.1,3.76,0.015000000000000003,0.25,0.25,0.0,0.0,0.0,simple
5583,"Prin urmare, indiferent cât de mult argou folosiți în limba dvs. maternă, limitarea utilizării argoului în limba franceză (proporțional cu nivelul dvs. de fluență) va limita, de asemenea, cât de mult sunteți tratat cu condescendență și amuzament de către ascultătorii nativi.",amuzament,0.1,3.35,0.015000000000000003,0.0,0.0,0.0,0.25,0.25,simple
5589,"Aceste stiluri de pachete nu se descurcă bine împotriva pachetelor cu orice tip de dezorganizare sau control, așa că în prezent nu au parte de prea mult joc.",parte,0.1,5.93,0.015000000000000003,0.25,0.0,0.0,0.25,0.0,simple
5590,"Aceste diagrame trebuie interpretate ca niște hărți topografice, unde liniile reprezintă curbe de nivel constante.",interpretate,0.15,3.92,0.015000000000000003,0.25,0.0,0.0,0.25,0.25,simple
5594,"Acestea necesitau bani, iar o nouă lume interlopă a criminalității a apărut pentru a le finanța și a profita de pe urma lor.",finanța,0.15,3.46,0.015000000000000003,0.25,0.25,0.0,0.25,0.0,simple
5595,"Acestea necesitau bani, iar o nouă lume interlopă a criminalității a apărut pentru a le finanța și a profita de pe urma lor.",profita,0.1,3.79,0.015000000000000003,0.25,0.0,0.0,0.25,0.0,simple
5603,Acestea nu interferează cu gesturile de care magii au nevoie pentru a face vrăji.,gesturile,0.1,3.19,0.015000000000000003,0.25,0.0,0.0,0.25,0.0,simple
5612,"Acest lucru se întâmplă tot timpul în visele mele, dar se pare că eu cred că pot face asta cu adevărat, iar visul continuă în mod nelucid.",pare,0.1,5.52,0.015000000000000003,0.25,0.0,0.0,0.25,0.0,simple
5615,"Aceasta include predarea, practica generală a medicinei, cercetarea medicală, domeniile religioase, antreprenoriatul, munca misionară, munca socială, dezvoltarea comunitară, artele creative, actoria, radiodifuziunea, consultanța, coaching-ul, formarea corporatistă, relațiile publice, consilierea, publicitatea și marketingul.",creative,0.1,3.94,0.015000000000000003,0.25,0.0,0.0,0.25,0.0,simple
5617,"Acest lucru este FOARTE, FOARTE diferit de modelele pasive de citire a textului într-o manieră liniară de mare viteză, care se aseamănă cu încercarea de a forța creierul să găsească un sens la o mie de gloanțe care trec cu viteză.",aseamănă,0.1,3.79,0.015000000000000003,0.25,0.0,0.0,0.25,0.0,simple
5618,"Acest lucru este FOARTE, FOARTE diferit de modelele pasive de citire a textului într-o manieră liniară de mare viteză, care se aseamănă cu încercarea de a forța creierul să găsească un sens la o mie de gloanțe care trec cu viteză.",gloanțe,0.1,3.66,0.015000000000000003,0.0,0.25,0.0,0.25,0.0,simple
5620,Aceasta este doar una dintre numeroasele realizări ale ingineriei care ne-au permis să cuantificăm și să înțelegem gena umană și modul în care aceasta este legată de nutriție.,realizări,0.1,4.09,0.015000000000000003,0.25,0.0,0.0,0.25,0.0,simple
5623,"Acest lucru este deosebit de util în cazuri precum cele în care se încearcă modificarea suprafeței nanomaterialelor pentru a crește afinitatea, reactivitatea sau compatibilitatea.",deosebit,0.1,4.73,0.015000000000000003,0.25,0.0,0.0,0.25,0.0,simple
5624,"Acest lucru este deosebit de util în cazuri precum cele în care se încearcă modificarea suprafeței nanomaterialelor pentru a crește afinitatea, reactivitatea sau compatibilitatea.",modificarea,0.15,4.29,0.015000000000000003,0.25,0.0,0.0,0.25,0.25,simple
5628,Această problemă a agitat teologii și filozofii timp de secole și nu a fost niciodată rezolvată în mod satisfăcător.,satisfăcător,0.15,3.3,0.015000000000000003,0.25,0.25,0.0,0.0,0.25,simple
5629,"Această revoluție a fost alimentată de utilizarea de noi tehnologii agricole, cum ar fi semănătoarea și îngrășămintele îmbunătățite.",revoluție,0.15,4.3,0.015000000000000003,0.25,0.25,0.0,0.25,0.0,simple
5630,"Această revoluție a fost alimentată de utilizarea de noi tehnologii agricole, cum ar fi semănătoarea și îngrășămintele îmbunătățite.",agricole,0.15,4.66,0.015000000000000003,0.25,0.25,0.0,0.25,0.0,simple
5631,"Această revoluție a fost alimentată de utilizarea de noi tehnologii agricole, cum ar fi semănătoarea și îngrășămintele îmbunătățite.",îmbunătățite,0.1,3.6,0.015000000000000003,0.25,0.0,0.0,0.0,0.25,simple
5632,Această transformare apare atunci când o celulă vie nepatogenă preia o bucată de ADN purtătoare a alelei de patogenitate.,transformare,0.15,4.16,0.015000000000000003,0.25,0.25,0.0,0.0,0.25,simple
5636,Aceasta a fost o lovitură devastatoare pentru japonezi și este considerată punctul de cotitură al Războiului din Pacific.,devastatoare,0.15,3.58,0.015000000000000003,0.25,0.0,0.0,0.25,0.25,simple
5640,"Deși Harry va deveni o excepție, există un alt elev, de asemenea orfan și vrăjitor talentat, căruia Dumbledore i-a acordat și el o atenție sporită, deși nu în același mod ca în cazul lui Harry.",acordat,0.15,4.88,0.015000000000000003,0.25,0.25,0.0,0.25,0.0,simple
5645,A trăi complet în acest mod într-o societate urbanizată și industrială înseamnă a te retrage la periferie.,retrage,0.1,4.27,0.015000000000000003,0.25,0.0,0.0,0.25,0.0,simple
5647,"Pentru a se familiariza cu demonstrația matematică și, de asemenea, cu unele concepte matematice de bază, cititorii pot citi wikibook Demonstrație matematică.",matematice,0.15,3.75,0.015000000000000003,0.25,0.0,0.0,0.25,0.25,simple
5653,"Până la începutul secolului al XIX-lea, naturaliștii și oamenii de știință au observat diferențe esențiale între compușii care proveneau din ființe vii și cei care nu proveneau din ființe vii.",știință,0.1,4.78,0.015000000000000003,0.0,0.0,0.0,0.25,0.25,simple
5654,"Până la începutul secolului al XIX-lea, naturaliștii și oamenii de știință au observat diferențe esențiale între compușii care proveneau din ființe vii și cei care nu proveneau din ființe vii.",observat,0.1,4.75,0.015000000000000003,0.25,0.25,0.0,0.0,0.0,simple
5655,"Până la începutul secolului al XIX-lea, naturaliștii și oamenii de știință au observat diferențe esențiale între compușii care proveneau din ființe vii și cei care nu proveneau din ființe vii.",esențiale,0.1,4.27,0.015000000000000003,0.25,0.0,0.0,0.25,0.0,simple
5658,"Folosește aceleași forme de acorduri ca și Open E, dar este mai ușor pentru gâtul chitarei, deoarece corzile sunt dezacordate, reducând tensiunea.",reducând,0.1,3.7,0.015000000000000003,0.25,0.0,0.0,0.0,0.25,simple
5659,"Stăpânii războiului din numeroasele provincii ale Chinei se dușmăneau în mod constant, iar guvernul central era slab și descentralizat, neputând face nimic pentru a opri conflictul.",constant,0.15,4.52,0.015000000000000003,0.25,0.25,0.0,0.25,0.0,simple
5661,"Stăpânii războiului din numeroasele provincii ale Chinei se dușmăneau în mod constant, iar guvernul central era slab și descentralizat, neputând face nimic pentru a opri conflictul.",neputând,0.1,3.67,0.015000000000000003,0.25,0.0,0.0,0.0,0.25,simple
5662,"Cu toate acestea, Washingtonul a devenit foarte îngrijorat de faptul că partidele comuniste locale ar putea câștiga puterea în Franța, Italia și Grecia la sfârșitul anilor 1940, având în vedere starea precară a economiei europene postbelice și apropierea de Uniuniea Sovietică.",câștiga,0.1,4.6,0.015000000000000003,0.0,0.0,0.0,0.25,0.25,simple
5664,"Cu toate acestea, Washingtonul a devenit foarte îngrijorat de faptul că partidele comuniste locale ar putea câștiga puterea în Franța, Italia și Grecia la sfârșitul anilor 1940, având în vedere starea precară a economiei europene postbelice și apropierea de Uniuniea Sovietică.",apropierea,0.1,4.73,0.015000000000000003,0.0,0.0,0.0,0.25,0.25,simple
5667,"Urmăriți câinele pentru a vă asigura că nu scuipă pastila după ce a mâncat recompensa (dacă se întâmplă acest lucru, va trebui să forțați pastila, așa cum este descris mai jos).",descris,0.1,4.33,0.015000000000000003,0.25,0.0,0.0,0.0,0.25,simple
5668,"Am discutat deja despre unele dintre acestea, însă cunoașterea seturilor adaugă o nouă definiție pentru fiecare dintre următoarele idei.",cunoașterea,0.1,4.3,0.015000000000000003,0.25,0.0,0.0,0.25,0.0,simple
5671,Recomandăm această licență în principal pentru lucrări al căror scop este de instruire sau de referință.,principal,0.1,5.11,0.015000000000000003,0.0,0.0,0.0,0.25,0.25,simple
5681,"Când ajung la destinație, cu terasa umbrită încă la vedere, desfășor prosoapele și mă întind confortabil pe scaunul înclinat.>>",umbrită,0.1,3.08,0.015000000000000003,0.0,0.0,0.0,0.25,0.25,simple
5682,"Când ajung la destinație, cu terasa umbrită încă la vedere, desfășor prosoapele și mă întind confortabil pe scaunul înclinat.>>",desfășor,0.15,0.0,0.015000000000000003,0.25,0.0,0.0,0.25,0.25,simple
5687,"Cu toate acestea, faptul că scorbutul este cauzat de lipsa vitaminei c a fost descoperit abia în 1932.",cauzat,0.1,4.2,0.015000000000000003,0.25,0.0,0.0,0.25,0.0,simple
5689,"Concepeți mai multe experimente pentru a vă testa ipotezele, folosind o lanternă pentru a dovedi că, într-adevăr, nu sunteți orb.",Concepeți,0.15,0.0,0.015000000000000003,0.25,0.0,0.25,0.0,0.25,simple
5693,"Puteți extrage un singur document dintr-o astfel de colecție și îl puteți distribui individual în temeiul prezentei licențe, cu condiția să inserați o copie a prezentei licențe în documentul extras și să respectați prezenta licență în toate celelalte privințe în ceea ce privește copierea textuală a documentului respectiv.",copie,0.1,4.38,0.015000000000000003,0.25,0.0,0.0,0.25,0.0,simple
5694,"Puteți extrage un singur document dintr-o astfel de colecție și îl puteți distribui individual în temeiul prezentei licențe, cu condiția să inserați o copie a prezentei licențe în documentul extras și să respectați prezenta licență în toate celelalte privințe în ceea ce privește copierea textuală a documentului respectiv.",extras,0.15,4.21,0.015000000000000003,0.25,0.0,0.0,0.25,0.25,simple
5697,"Acordurile dvs. juridice ar trebui să treacă prin mai multe iterații în procesul de redactare, fiecare iterație simplificând termenii și îmbunătățind lizibilitatea și utilizabilitatea acestora.",îmbunătățind,0.15,0.0,0.015000000000000003,0.25,0.0,0.0,0.25,0.25,simple
